{
  "schema_version": 1,
  "registry": {
    "id": "a1b7d74a-0c02-5c99-a74e-0b3fb449c92f",
    "version": "1.3.0"
  },
  "recognition_rules": [
    {
      "id": "poste-codigo-catalogo",
      "category": "POSTE",
      "evidence_types": ["TEXTO", "OCR"],
      "strategy": "CODIGO_CATALOGO",
      "base_confidence": "0.82",
      "maximum_context_distance": "0.025",
      "enabled": true
    },
    {
      "id": "estrutura-mt-codigo-catalogo",
      "category": "ESTRUTURA_MT",
      "evidence_types": ["TEXTO", "OCR"],
      "strategy": "CODIGO_CATALOGO",
      "base_confidence": "0.84",
      "maximum_context_distance": "0.025",
      "enabled": true
    },
    {
      "id": "estrutura-bt-codigo-catalogo",
      "category": "ESTRUTURA_BT",
      "evidence_types": ["TEXTO", "OCR"],
      "strategy": "CODIGO_CATALOGO",
      "base_confidence": "0.84",
      "maximum_context_distance": "0.025",
      "enabled": true
    },
    {
      "id": "cabo-codigo-catalogo",
      "category": "CABO",
      "evidence_types": ["TEXTO", "OCR"],
      "strategy": "CODIGO_CATALOGO",
      "base_confidence": "0.80",
      "maximum_context_distance": "0.040",
      "enabled": true
    },
    {
      "id": "equipamento-codigo-catalogo",
      "category": "EQUIPAMENTO",
      "evidence_types": ["TEXTO", "OCR"],
      "strategy": "CODIGO_CATALOGO",
      "base_confidence": "0.84",
      "maximum_context_distance": "0.025",
      "enabled": true
    }
  ],
  "relation_rules": [
    {
      "id": "estrutura-mt-instalada-em-poste",
      "origin_category": "ESTRUTURA_MT",
      "destination_category": "POSTE",
      "relation_type": "INSTALADA_EM",
      "strategy": "CENTROS_PROXIMOS",
      "maximum_distance": "0.100",
      "confidence": "0.78",
      "enabled": true
    },
    {
      "id": "estrutura-bt-instalada-em-poste",
      "origin_category": "ESTRUTURA_BT",
      "destination_category": "POSTE",
      "relation_type": "INSTALADA_EM",
      "strategy": "CENTROS_PROXIMOS",
      "maximum_distance": "0.100",
      "confidence": "0.78",
      "enabled": true
    },
    {
      "id": "equipamento-instalado-em-poste",
      "origin_category": "EQUIPAMENTO",
      "destination_category": "POSTE",
      "relation_type": "INSTALADO_EM",
      "strategy": "CENTROS_PROXIMOS",
      "maximum_distance": "0.100",
      "confidence": "0.78",
      "enabled": true
    },
    {
      "id": "cabo-conectado-a-poste",
      "origin_category": "CABO",
      "destination_category": "POSTE",
      "relation_type": "CONECTA",
      "strategy": "EXTREMIDADES_PROXIMAS",
      "maximum_distance": "0.100",
      "confidence": "0.80",
      "enabled": true
    },
    {
      "id": "cabo-conectado-a-equipamento",
      "origin_category": "CABO",
      "destination_category": "EQUIPAMENTO",
      "relation_type": "CONECTA",
      "strategy": "EXTREMIDADES_PROXIMAS",
      "maximum_distance": "0.035",
      "confidence": "0.76",
      "enabled": true
    },
    {
      "id": "cabo-suportado-por-estrutura-mt",
      "origin_category": "CABO",
      "destination_category": "ESTRUTURA_MT",
      "relation_type": "SUPORTADO_POR",
      "strategy": "COMPATIBILIDADE_E_PROXIMIDADE",
      "maximum_distance": "0.040",
      "confidence": "0.74",
      "enabled": true
    },
    {
      "id": "cabo-suportado-por-estrutura-bt",
      "origin_category": "CABO",
      "destination_category": "ESTRUTURA_BT",
      "relation_type": "SUPORTADO_POR",
      "strategy": "COMPATIBILIDADE_E_PROXIMIDADE",
      "maximum_distance": "0.040",
      "confidence": "0.74",
      "enabled": true
    }
  ]
}
